Policy Area,Pre-Election Promise,Current Status (Oct 2025),Direction
Gender Recognition Process,Simplify but keep medical diagnosis,Not yet implemented,Stalled
Conversion Therapy Ban,Full trans-inclusive ban,"Promised, draft bill not published",Delayed
Puberty Blockers,Follow Cass Review,Permanent ban imposed Dec 2024,Restrictive
Hate Crime Legislation,Make aggravated offence,Committed in Crime Bill June 2025,Progressive
Single-Sex Spaces,Protect but respect trans rights,Delayed approval of EHRC guidance,Unclear
NHS Gender Clinics,Improve services and waiting times,"Review launched, pilot support",Mixed
Equality Act,Protect and maintain,Supports Supreme Court interpretation,Neutral
